{"files":[{"path":"candidate.json","sha256":"493838e465bac455d385ed7b79277ba117f312195ec2ff5ee1d343ad0b1ef25a","size_bytes":2917},{"path":"package/component.wasm","sha256":"d600259d2545d7a61bc7c797edcab264713b9fe6df0997d62a641af1cb4c2982","size_bytes":65595},{"path":"package/manifest.json","sha256":"8e213e1651969c920138d9ea158565f7a1dac228580c21c4c407dcba23946962","size_bytes":6992},{"path":"package/provenance.json","sha256":"7de4b1c9d768ce6979fb3d111451cbf111f8c519d9e625550cca37f76d98ed99","size_bytes":1606},{"path":"package/sbom.cdx.json","sha256":"d62469857ab6265e98194878a1ac5ce219769c832e68fc2c797fac20b761cd25","size_bytes":362},{"path":"package/web-runtime/app-21aab8215b5805ce7dcde13087f4967ddbfd14e8e69066c7a36ad2e05c0a6034.jco.mjs","sha256":"21aab8215b5805ce7dcde13087f4967ddbfd14e8e69066c7a36ad2e05c0a6034","size_bytes":207339},{"path":"package/web-runtime/derivation-355ef3aec3aad0a6c94a203efb8a086a65cd551df2f419fa17d11f77d91e578d.json","sha256":"355ef3aec3aad0a6c94a203efb8a086a65cd551df2f419fa17d11f77d91e578d","size_bytes":1259},{"path":"package/web-runtime/host-adapter-5f1edc6f4ff369d10974f7000c3e0204060708f1d3db90790ad049738c00a388.mjs","sha256":"5f1edc6f4ff369d10974f7000c3e0204060708f1d3db90790ad049738c00a388","size_bytes":1859}],"info_hash":"a70b22b07d956cf12d9b545af897115867f456ac","magnet_uri":"magnet:?xt=urn:btih:a70b22b07d956cf12d9b545af897115867f456ac&dn=f3768d912af30054392f7a8e254ac87283ca02c4fc82476ddcafe3fd00906dce.vibapp-candidate&tr=wss%3A%2F%2Ftracker.webtorrent.dev","package_digest_sha256":"f3768d912af30054392f7a8e254ac87283ca02c4fc82476ddcafe3fd00906dce","schema_version":"vibapp.roomhash-package-locator.experimental-v1","size_bytes":287929,"transport":"bittorrent-v1","trust_note":"locator-only-package-bytes-require-vibapp-verification"}
